{
  "schema_version": "0.1.0",
  "flow": {
    "name": "Registrar solicitud",
    "session_id": "flow-001",
    "observed_start": "2026-08-25T13:20:30.000-06:00",
    "observed_end": "2026-08-25T13:22:14.000-06:00"
  },
  "engine": {
    "agent": "golden-fixture",
    "analyzed_at": "2026-08-28T00:00:00-06:00"
  },
  "components": [
    {
      "name": "ventanilla (cliente HTTP)",
      "role": "cliente",
      "observed_in": [
        "E-001",
        "E-006"
      ]
    },
    {
      "name": "ApplicationsResource",
      "role": "endpoint REST",
      "observed_in": [
        "E-001",
        "E-005",
        "E-014"
      ]
    },
    {
      "name": "ApplicationService",
      "role": "lógica de negocio",
      "observed_in": [
        "E-002",
        "E-004",
        "E-007",
        "E-010",
        "E-013"
      ]
    },
    {
      "name": "PostgreSQL (solicitudes)",
      "role": "base de datos",
      "observed_in": [
        "E-003",
        "E-008",
        "E-009",
        "E-011",
        "E-012"
      ]
    }
  ],
  "steps": [
    {
      "order": 1,
      "timestamp": "2026-08-25T13:20:44.118-06:00",
      "component": "ApplicationsResource",
      "action": "POST /api/applications (citizenId 1003) — primer intento",
      "correlation_basis": "correlation_id req-8171",
      "evidence": [
        "E-001"
      ]
    },
    {
      "order": 2,
      "timestamp": "2026-08-25T13:20:44.401-06:00",
      "component": "ApplicationService",
      "action": "registerApplication(1003)",
      "correlation_basis": "ventana temporal + thread default task-1",
      "evidence": [
        "E-002"
      ]
    },
    {
      "order": 3,
      "timestamp": "2026-08-25T13:20:44.517-06:00",
      "component": "PostgreSQL (solicitudes)",
      "action": "SELECT id, nombre, status, nationality FROM citizen WHERE id = 1003",
      "correlation_basis": "ventana temporal + backend pid 1249",
      "evidence": [
        "E-003"
      ]
    },
    {
      "order": 4,
      "timestamp": "2026-08-25T13:20:44.602-06:00",
      "component": "ApplicationService",
      "action": "rechazo: estado del ciudadano SUSPENDED — no se ejecuta ninguna escritura",
      "correlation_basis": "ventana temporal + thread default task-1",
      "evidence": [
        "E-004"
      ]
    },
    {
      "order": 5,
      "timestamp": "2026-08-25T13:20:44.655-06:00",
      "component": "ApplicationsResource",
      "action": "HTTP 409 'El ciudadano no se encuentra activo'",
      "correlation_basis": "correlation_id req-8171",
      "evidence": [
        "E-005"
      ]
    },
    {
      "order": 6,
      "timestamp": "2026-08-25T13:21:01.204-06:00",
      "component": "ApplicationsResource",
      "action": "POST /api/applications (citizenId 1001) — segundo intento",
      "correlation_basis": "correlation_id req-8172",
      "evidence": [
        "E-006"
      ]
    },
    {
      "order": 7,
      "timestamp": "2026-08-25T13:21:01.512-06:00",
      "component": "ApplicationService",
      "action": "registerApplication(1001)",
      "correlation_basis": "ventana temporal + thread default task-2",
      "evidence": [
        "E-007"
      ]
    },
    {
      "order": 8,
      "timestamp": "2026-08-25T13:21:01.640-06:00",
      "component": "PostgreSQL (solicitudes)",
      "action": "SELECT id, nombre, status, nationality FROM citizen WHERE id = 1001",
      "correlation_basis": "ventana temporal + backend pid 1251",
      "evidence": [
        "E-008"
      ]
    },
    {
      "order": 9,
      "timestamp": "2026-08-25T13:21:01.788-06:00",
      "component": "PostgreSQL (solicitudes)",
      "action": "SELECT nextval('folio_seq')",
      "correlation_basis": "ventana temporal + backend pid 1251",
      "evidence": [
        "E-009"
      ]
    },
    {
      "order": 10,
      "timestamp": "2026-08-25T13:21:01.802-06:00",
      "component": "ApplicationService",
      "action": "folio generado: SOL-2026-000042",
      "correlation_basis": "ventana temporal + thread default task-2",
      "evidence": [
        "E-010"
      ]
    },
    {
      "order": 11,
      "timestamp": "2026-08-25T13:21:01.910-06:00",
      "component": "PostgreSQL (solicitudes)",
      "action": "INSERT INTO application (folio SOL-2026-000042, citizen 1001, estado REGISTERED)",
      "correlation_basis": "ventana temporal + backend pid 1251",
      "evidence": [
        "E-011"
      ]
    },
    {
      "order": 12,
      "timestamp": "2026-08-25T13:21:02.031-06:00",
      "component": "PostgreSQL (solicitudes)",
      "action": "INSERT INTO application_history (application 87, estado REGISTERED)",
      "correlation_basis": "ventana temporal + backend pid 1251",
      "evidence": [
        "E-012"
      ]
    },
    {
      "order": 13,
      "timestamp": "2026-08-25T13:21:02.104-06:00",
      "component": "ApplicationService",
      "action": "solicitud registrada",
      "correlation_basis": "ventana temporal + thread default task-2",
      "evidence": [
        "E-013"
      ]
    },
    {
      "order": 14,
      "timestamp": "2026-08-25T13:21:02.187-06:00",
      "component": "ApplicationsResource",
      "action": "HTTP 201 {folio: SOL-2026-000042}",
      "correlation_basis": "correlation_id req-8172",
      "evidence": [
        "E-014"
      ]
    }
  ],
  "candidate_rules": [
    {
      "id": "R-001",
      "statement": "El sistema parece exigir que el ciudadano esté en estado ACTIVE antes de registrar una solicitud: con estado SUSPENDED la petición se rechaza con HTTP 409 y no se ejecuta ninguna escritura en base de datos.",
      "confidence": "fuertemente_sustentada",
      "evidence": [
        "E-003",
        "E-004",
        "E-005",
        "E-008",
        "E-011"
      ],
      "code_refs": [
        "artifacts/source/src/main/java/gob/demo/solicitudes/service/ApplicationService.java:35-38"
      ]
    },
    {
      "id": "R-002",
      "statement": "El folio parece formarse con el prefijo SOL, el año en curso y un consecutivo obtenido de la secuencia folio_seq de la base de datos.",
      "confidence": "fuertemente_sustentada",
      "evidence": [
        "E-009",
        "E-010"
      ],
      "code_refs": [
        "artifacts/source/src/main/java/gob/demo/solicitudes/dao/ApplicationDao.java:20-32"
      ]
    },
    {
      "id": "R-003",
      "statement": "Cada solicitud registrada parece generar además un renglón inicial de historial con estado REGISTERED, dentro de la misma operación.",
      "confidence": "fuertemente_sustentada",
      "evidence": [
        "E-011",
        "E-012"
      ],
      "code_refs": [
        "artifacts/source/src/main/java/gob/demo/solicitudes/service/ApplicationService.java:47-48"
      ]
    }
  ],
  "queries": [
    {
      "operation": "SELECT",
      "table": "citizen",
      "statement": "SELECT id, nombre, status, nationality FROM citizen WHERE id = $1",
      "evidence": [
        "E-003",
        "E-008"
      ]
    },
    {
      "operation": "SELECT",
      "table": "folio_seq",
      "statement": "SELECT nextval('folio_seq')",
      "evidence": [
        "E-009"
      ]
    },
    {
      "operation": "INSERT",
      "table": "application",
      "statement": "INSERT INTO application (folio, citizen_id, tipo_tramite, estado, fecha_registro) VALUES ($1, $2, $3, 'REGISTERED', now())",
      "evidence": [
        "E-011"
      ]
    },
    {
      "operation": "INSERT",
      "table": "application_history",
      "statement": "INSERT INTO application_history (application_id, estado, fecha) VALUES ($1, $2, now())",
      "evidence": [
        "E-012"
      ]
    }
  ],
  "dependencies": [
    {
      "name": "PostgreSQL — base de datos solicitudes",
      "kind": "base de datos",
      "detail": "Accedida vía el datasource SolicitudesDS con el usuario solicitudes_app. Única dependencia con evidencia de ejecución en la ventana observada.",
      "evidence": [
        "E-003",
        "E-008",
        "E-009",
        "E-011",
        "E-012"
      ]
    }
  ],
  "errors": [
    {
      "description": "Rechazo de negocio (no defecto): ciudadano 1003 con estado SUSPENDED; la operación termina en HTTP 409 sin escrituras.",
      "component": "ApplicationService",
      "evidence": [
        "E-004",
        "E-005"
      ]
    }
  ],
  "contradictions": [
    {
      "expected": "manual-tecnico.md §3, paso 5: 'Se envía un correo de confirmación al ciudadano con el folio asignado, a través del servidor SMTP institucional'. La configuración declara notificaciones.habilitado=true.",
      "observed": "No hay ninguna evidencia de envío de correo ni de conexión SMTP en la ventana observada: el flujo pasa del INSERT de historial directamente a la respuesta HTTP 201. En el código, NotificationService está inyectado en ApplicationService pero sendRegistrationEmail nunca se invoca.",
      "possible_causes": [
        "código muerto",
        "configuración",
        "comportamiento dependiente del ambiente"
      ],
      "evidence": [
        "E-012",
        "E-013",
        "E-014"
      ]
    },
    {
      "expected": "manual-tecnico.md §4: el estado del ciudadano 'se utiliza con fines estadísticos y de depuración del padrón'.",
      "observed": "El estado del ciudadano condiciona el registro: un ciudadano SUSPENDED es rechazado con HTTP 409 antes de cualquier escritura (ver R-001).",
      "possible_causes": [
        "documentación desactualizada",
        "condición no documentada"
      ],
      "evidence": [
        "E-004",
        "E-005"
      ]
    }
  ],
  "unknowns": [
    {
      "question": "¿Qué ocurre cuando el ciudadano no es de nacionalidad MX?",
      "why_unknown": "El código muestra una bifurcación hacia processForeignApplication (ApplicationService.java:40-42) que agrega un historial PENDING_CONSULAR_REVIEW, pero el flujo observado no la ejercitó: ambos intentos fueron de ciudadanos MX.",